<?xml version="1.0" encoding="UTF-8"?>

<root
    xmlns:xsi='http://www.w3.org/2001/XMLSchema-instance'
    xmlns='http://luoying.huliqing.name'
    xsi:schemaLocation='http://luoying.huliqing.name ../../../../ly-kernel/src/LuoYing/Data/meta/logic.xsd'>
    
    <!-- ========================================================================== -->
    <!-- Base-->
    <!-- ========================================================================= -->

    <!--逻辑基类，所有逻辑都继承这个设置, 默认逻辑频率1.0秒，子设置根据实际情况设置-->
    
    <!--注：enabledCheckEl属性很重要，这个作为逻辑的开关，大部分情况下，角色必须是“活着的”才可以执行逻辑, 特别是
        一些特殊的可以改变角色属性的逻辑, 例如：可以改变角色健康值的逻辑，如果在角色死亡之后还运行，则可能让角色重新
        活起来。
    -->
    <logicBase id="logicBase" interval="1"
               enabledCheckEl="elActorUndeadCheck"
               bindTargetAttribute="attributeTarget" 
               bindViewAttribute="attributeVision" 
               enemyCheckEl="elActorEnemyCheck" />

    <!--战斗类逻辑: bindAiAttribute用于作为AI逻辑开关-->
    <logicFight id="logicFightBase" extends="logicBase" bindAiAttribute="attributeAutoAi" />
    
    <!--空闲类逻辑-->
    <logicIdle id="logicIdleBase" extends="logicBase" patrolCheckEl="#{!s.attributePlayer && s.attributeFollow <= 0}" />
    
    <!--通知类-->
    <logicNotify id="logicNotifyBase" extends="logicBase" />
    
    <!--侦察敌人的逻辑-->
    <logicSearchEnemy id="logicSearchEnemyBase" extends="logicBase" interval="2" />
    
    <!--商店逻辑：频率不用太高-->
    <logicShop id="logicShopBase" extends="logicBase" interval="30" />

    <!-- ========================================================================== -->
    <!-- Common -->
    <!-- ========================================================================= -->
    
    <!--默认的搜寻敌人的逻辑-->
    <logicSearchEnemy id="logicSearchEnemy" extends="logicSearchEnemyBase" />
    
    <!--默认的防守及躲闪逻辑-->
    <logicDefend id="logicDefend" interval="5" extends="logicBase" defendRateAttribute="attributeDefenceRate" duckRateAttribute="attributeDuckRate" 
                      listenAttributes="attributeHealth" listenSkillTypes="fight" defendSkillTypes="defend" duckSkillTypes="duck" />
    <!--空闲行为-->
    <logicIdle id="logicPatrol" extends="logicIdleBase" interval="5" idleSimpleAction="actionDynamicIdle" idlePatrolAction="actionPatrolIdle" />
    
    <!-- 动态战斗逻辑: 能够移动、战斗、跟随等的角色逻辑。如：人物，怪兽 -->
    <logicFight id="logicDynamicFight" extends="logicFightBase" fightAction="actionDynamicFight" />

    <!-- 静止类战斗逻辑：能够战斗但不能移动和转动的角色。如：防御塔，静止类武器等 -->
    <logicFight id="logicStaticFight" extends="logicFightBase" fightAction="actionStaticFight" />
    
    <!-- 跟随目标的逻辑 -->
    <logicFollow id="logicFollow" extends="logicBase" bindFollowAttribute="attributeFollow" followAction="actionFollow" />

    <!--通知逻辑-->
    <logicNotify id="logicNotify" extends="logicNotifyBase" />
    <logicNotify id="logicNotifyForce" extends="logicNotifyBase" />
    
    <!-- 向目标位置移动的逻辑 -->
    <logicPosition id="logicPosition" extends="logicBase" runAction="actionRun" />
    
   <!-- ==================================================================== -->
   <!-- 特定角色逻辑-->
   <!-- ==================================================================== -->
    
    <!--注：给商店逻辑配置一定的金币，这样当出售东西给商店时，商店才有钱可以购买玩家的商品-->
    
    <!--宝箱: 商店逻辑-->
    <logicShop id="logicShopTreasure" extends="logicShopBase" items="itemGold|10000,itemTonicRed|10,itemTonicBlue|10
,itemHerb|5,itemDetoxifyGrass|5,itemScrollLife|5,itemBook007|1" stockSpeed="1" />
    
<!--    <logicShop id="logicShopTreasure" extends="logicBase" items="itemTonicRed|10,itemTonicBlue|10,itemHerb|5,itemDetoxifyGrass|5
,itemGold|1000    
,itemScrollLife|5
,itemBook007|1
,skinEar004|1,skinBlinder001|1,skinMouthmask001|1,skinHorn001|1
,weaponSword001|1,weaponSword001L|1,weaponSword002,weaponSword002L,weaponSword003,weaponSword003L
,weaponBow001,weaponWand000" stockSpeed="0.1" />-->

    <!--杰米: 商店逻辑-->
    <logicShop id="logicShopJaime" extends="logicShopBase" items="itemGold|10000,itemTonicRed|10,itemTonicBlue|10,itemHerb|5,itemBook009|1" stockSpeed="1" />
    
    <!--用于黑暗祭坛,让角色生命恢复及魔法恢复更快-->
    <logicAttributeChange id="logicIncreaseAltarLife" extends="logicBase" value="10" applyAttribute="attributeHealth" bindFactorAttribute="attributeHealthRestore" interval="3" />
    
</root>



